{
  "name": "Redfin",
  "industry": "Real Estate",
  "hqCountry": "United States",
  "domain": "redfin.com",
  "icon": "redfin.png",
  "events": [
    {
      "id": "redfin-2025-02-12",
      "date": "2025-02-12",
      "headcount": 450,
      "country": "United States",
      "reason": "acquisition",
      "dataset": "curated",
      "externalId": "curated:8ab0717c1ff699673b62",
      "sources": [
        {
          "url": "https://www.realestatenews.com/2025/02/12/redfin-to-cut-450-roles-following-zillow-rentals-deal",
          "title": "Redfin to cut 450 roles following Zillow rentals deal",
          "description": "The company, which signed an exclusive listings partnership with Zillow on Feb. 11, will complete the layoffs in July as it restructures its rentals segment.",
          "image": "https://images.ctfassets.net/hzfwsdcegxo2/1ygBkzMIEqvOU978Ltrg8W/6904cd3a57c8e8c71a88ca35925c0c83/Redfin_layoffs_Feb_2025.jpg?w=1200&h=630&fit=fill",
          "siteName": "RealEstateNews.com"
        }
      ]
    },
    {
      "id": "6355cea0-bb95-4e8c-a3b4-cc3c666536a0",
      "date": "2022-11-09",
      "headcount": 862,
      "percent": 13,
      "country": "United States",
      "reason": "market_downturn",
      "sources": [
        {
          "url": "https://www.hrdive.com/news/redfin-layoffs-troubled-real-estate-industry/636256/",
          "title": "Redfin lays off 13% of workforce as trouble comes to real estate industry",
          "description": "This news coincides with Meta’s own Nov. 10 layoff announcement, also amounting to a 13% workforce reduction, and Twitter’s ongoing layoff saga.",
          "image": "https://imgproxy.divecdn.com/yjNTVrq2UdswR92UMR3r_4w0ax1QmwS7OlovfGRMyWc/g:nowe:6:832/c:5994:3386/rs:fit:770:435/Z3M6Ly9kaXZlc2l0ZS1zdG9yYWdlL2RpdmVpbWFnZS9HZXR0eUltYWdlcy04NjkwNTE5MzIuanBn.webp",
          "siteName": "HR Dive"
        }
      ]
    }
  ]
}
