{
  "name": "Apple",
  "industry": "Consumer technology",
  "domain": "apple.com",
  "icon": "apple.png",
  "events": [
    {
      "id": "78cce7ef-0ed5-4f4f-a438-a1e7395978ca",
      "date": "2026-08-21",
      "headcount": 200,
      "country": "United States",
      "reason": "other",
      "dataset": "ai-layoffs-index",
      "externalId": "ailayoffs:9a3bc8612629ff361275",
      "sources": [
        {
          "url": "https://techcrunch.com/2026/08/21/apple-is-reportedly-cutting-hundreds-of-jobs-from-siri-vision-pro-teams/",
          "title": "Apple is reportedly cutting hundreds of jobs from Siri, Vision Pro teams | TechCrunch",
          "description": "Apple has admitted that some roles are being impacted as it shifts its focus away from certain initiatives.",
          "image": "https://techcrunch.com/wp-content/uploads/2024/06/Apple-Vision-Pro-global-availability-e1718041644616.jpg?resize=1200,676",
          "siteName": "TechCrunch"
        }
      ]
    }
  ]
}
